<!ELEMENT math (mrow)>
<!ELEMENT mrow (msup,(mo|mn)+)>
<!ELEMENT msup (mi,mn)>
<!ELEMENT mo (#PCDATA)>
<!ELEMENT mn (#PCDATA)>
<!ELEMENT mi (#PCDATA)>